<?xml version="1.0" encoding="UTF-8"?>
<!--
my awesome burger order
-->

<!DOCTYPE order SYSTEM 'bonanza.dtd'>

<order type="deliver">
    <customer>William</customer>
    <delivery>123 fake street</delivery>
    <burger>
        <patty type="pork"/>
        <cheeses bottom="swiss"/>
        <topping type="shrooms"/>
        <topping type="salsa"/>
        <topping type="bacon"/>
        <sauce type="mayo"/>
        <sauce type="ketchup"/>
        <instructions>make it extra porky</instructions>
        <name>Superburger</name>      
    </burger>
    <burger>
        <patty type="beef"/>
        <instructions>add peanut butter on this</instructions>
        <name>the beef and peanut butter burger</name>
    </burger>
    <special>plz deliver fast</special>
</order>
